[
  {
    "name": "production",
    "description": "Production Prometheus Server",
    "url": "https://prometheus-prod.example.com",
    "token": "your-production-bearer-token",
    "verify_ssl": true
  },
  {
    "name": "staging",
    "description": "Staging Prometheus Server",
    "url": "https://prometheus-staging.example.com",
    "token": "your-staging-bearer-token",
    "verify_ssl": false
  },
  {
    "name": "development",
    "description": "Development Prometheus Server",
    "url": "https://prometheus-dev.example.com",
    "token": "",
    "verify_ssl": true
  }
]

